{
  "$schema": "https://json-schema.org/draft/2020-12/schema",
  "$id": "https://agentic-engineering-os/schemas/first-contact-manifest/1",
  "title": "First-contact manifest (unsigned; bound by the first-contact code; RoT-1 revision 6, PROPOSED; 32 §3)",
  "description": "The first-contact code is gov-fc:<first 8 hex of lineage_id>:<state_sequence>:<64 hex SHA-256 of the GOV-JCS-1 bytes of this object>. The manifest is the only selector of lineage, state epoch and admitter set at first admission (32 FC-5).",
  "x-schema-version": "1.0.0",
  "type": "object",
  "additionalProperties": false,
  "required": [
    "schema",
    "lineage_id",
    "state_epoch",
    "admitters",
    "issued_at"
  ],
  "properties": {
    "schema": {
      "const": "governance-os.first-contact-manifest/1"
    },
    "lineage_id": {
      "type": "string",
      "pattern": "^sha256:[0-9a-f]{64}$"
    },
    "state_epoch": {
      "type": "object",
      "additionalProperties": false,
      "required": [
        "root_version",
        "root_digest",
        "policy_version",
        "policy_digest",
        "state_sequence",
        "state_digest"
      ],
      "properties": {
        "root_version": {
          "type": "integer",
          "minimum": 1
        },
        "root_digest": {
          "type": "string",
          "pattern": "^sha256:[0-9a-f]{64}$"
        },
        "policy_version": {
          "type": "integer",
          "minimum": 1
        },
        "policy_digest": {
          "type": "string",
          "pattern": "^sha256:[0-9a-f]{64}$"
        },
        "state_sequence": {
          "type": "integer",
          "minimum": 1
        },
        "state_digest": {
          "type": "string",
          "pattern": "^sha256:[0-9a-f]{64}$"
        }
      }
    },
    "admitters": {
      "type": "object",
      "minProperties": 1,
      "additionalProperties": {
        "type": "string",
        "pattern": "^sha256:[0-9a-f]{64}$"
      },
      "description": "target -> SHA-256 of the registered, quorum-reproduced gov-admit; equals the selected Trust Policy's bootstrap.admitter_digests"
    },
    "issued_at": {
      "type": "string",
      "pattern": "^\\d{4}-\\d{2}-\\d{2}T\\d{2}:\\d{2}:\\d{2}Z$"
    },
    "valid_until": {
      "type": "string",
      "pattern": "^\\d{4}-\\d{2}-\\d{2}T\\d{2}:\\d{2}:\\d{2}Z$"
    }
  }
}
